{"schema":"ssrobot.ConformanceReport","version":1,"runtime":"replay","runtime_version":"1","description":"21512cf41085a031404da45532d992024c40a04545a30adfbea784a518e3f2cf","checks":[{"name":"open","outcome":"passed","detail":"opened replay on clock replay:replay at 0 ns"},{"name":"trajectory_contract","outcome":"passed","detail":"3 steps of the declared 10000000 ns, linear interpolation"},{"name":"observe","outcome":"passed","detail":"observed left_arm_q=(0.0, 0.0), right_arm_q=(0.0, 0.0)"},{"name":"no_progress_before_step","outcome":"passed","detail":"pending until one step of 10000000 ns, then succeeded"},{"name":"independent_components","outcome":"passed","detail":"left_arm and right_arm ran concurrently from different sources"},{"name":"ownership","outcome":"passed","detail":"another source was refused; the same source superseded; an independent arm was free"},{"name":"cancel","outcome":"passed","detail":"canceled while active; ownership released to another source"},{"name":"timeout","outcome":"passed","detail":"timed out 30000000 ns after submission, deadline 30000000 ns"},{"name":"runtime_rejection","outcome":"passed","detail":"rejected with start_mismatch"},{"name":"stale_command","outcome":"passed","detail":"stale chunk refused before the runtime; fresh chunk succeeded"},{"name":"fault","outcome":"passed","detail":"fault failed only the affected arm, blocked submissions, and cleared on recovery"},{"name":"composite_fault","outcome":"passed","detail":"a fault on left_arm failed the running both_arms in the context and the runtime; three steps after recovery stayed clean"},{"name":"privileged_marking","outcome":"passed","detail":"0 privileged channel(s) refused to portable-only; 'left_arm_q' accepted"},{"name":"scene_observation","outcome":"not_applicable","detail":"the runtime declares no scene channels"},{"name":"snapshot_and_attachment","outcome":"not_applicable","detail":"needs a scene object, an end effector, and a joint group to command"},{"name":"external_clock","outcome":"not_applicable","detail":"the runtime is manually clocked"},{"name":"backend_versions","outcome":"not_applicable","detail":"the runtime reports no simulator backend"},{"name":"terminal_short_circuit","outcome":"passed","detail":"run_until returned rejected, succeeded, and canceled executions, twice, without bounds and with 0 runtime calls"},{"name":"close","outcome":"passed","detail":"close canceled unfinished work; later calls and reopening were refused"}]}
