{"schema":"ssrobot.ConformanceReport","version":1,"runtime":"replay","runtime_version":"1","description":"21512cf41085a031404da45532d992024c40a04545a30adfbea784a518e3f2cf","checks":[{"name":"open","outcome":"passed","detail":"opened replay on clock replay:replay_external at 10000000 ns"},{"name":"trajectory_contract","outcome":"not_applicable","detail":"an external clock's period is nominal"},{"name":"observe","outcome":"not_applicable","detail":"needs a manual clock and two joint groups offering position and trajectory commands and a joint-position channel"},{"name":"no_progress_before_step","outcome":"not_applicable","detail":"needs a manual clock and two joint groups offering position and trajectory commands and a joint-position channel"},{"name":"independent_components","outcome":"not_applicable","detail":"needs a manual clock and two joint groups offering position and trajectory commands and a joint-position channel"},{"name":"ownership","outcome":"not_applicable","detail":"needs a manual clock and two joint groups offering position and trajectory commands and a joint-position channel"},{"name":"cancel","outcome":"not_applicable","detail":"needs a manual clock and two joint groups offering position and trajectory commands and a joint-position channel"},{"name":"timeout","outcome":"not_applicable","detail":"needs a manual clock and two joint groups offering position and trajectory commands and a joint-position channel"},{"name":"runtime_rejection","outcome":"not_applicable","detail":"needs a manual clock and two joint groups offering position and trajectory commands and a joint-position channel"},{"name":"stale_command","outcome":"not_applicable","detail":"needs a manual clock and two joint groups offering position and trajectory commands and a joint-position channel"},{"name":"fault","outcome":"not_applicable","detail":"needs a manual clock and two joint groups offering position and trajectory commands and a joint-position channel"},{"name":"composite_fault","outcome":"not_applicable","detail":"needs a manual clock and two joint groups offering position and trajectory commands and a joint-position channel"},{"name":"privileged_marking","outcome":"passed","detail":"0 privileged channel(s) refused to portable-only; 'left_arm_q' accepted"},{"name":"scene_observation","outcome":"not_applicable","detail":"the runtime declares no scene channels"},{"name":"snapshot_and_attachment","outcome":"not_applicable","detail":"needs a scene object, an end effector, and a joint group to command"},{"name":"external_clock","outcome":"passed","detail":"a command succeeded through updates alone; stepping was refused"},{"name":"backend_versions","outcome":"not_applicable","detail":"the runtime reports no simulator backend"},{"name":"terminal_short_circuit","outcome":"not_applicable","detail":"needs a manual clock and two joint groups offering position and trajectory commands and a joint-position channel"},{"name":"close","outcome":"not_applicable","detail":"needs a manual clock and two joint groups offering position and trajectory commands and a joint-position channel"}]}
